{
  "$schema": "http://json-schema.org/draft-07/schema#",
  "$id": "https://nba-sim/config/schemas/fsm.schema.json",
  "title": "NBA Sim FSM Transition Table (foundation 0.1.0)",
  "description": "Closed set of phases plus the full (from, trigger) -> to transition table for v0.1.0. The phases array is fixed at 15 entries; adding or removing a phase requires a foundation_version bump per docs/foundation/README.md semver policy. The transition rows are the structural enforcement of the FSM; the narrative rules live in docs/foundation/fsm.md.",
  "type": "object",
  "required": [
    "foundation_version",
    "phases",
    "transitions",
    "timeout_allotments",
    "substitution_legality"
  ],
  "additionalProperties": false,
  "properties": {
    "foundation_version": {
      "type": "string",
      "pattern": "^\\d+\\.\\d+\\.\\d+$",
      "description": "Semver stamp of the FSM contract. Must match config/foundation.json#foundation_version."
    },
    "phases": {
      "type": "array",
      "minItems": 15,
      "maxItems": 15,
      "uniqueItems": true,
      "items": { "$ref": "#/$defs/phaseName" },
      "description": "Closed set of FSM phases for v0.1.0. The min/max Items pair pins the count; uniqueItems rejects duplicates; the $defs/phaseName enum rejects unknown values. Adding a phase requires bumping foundation_version and updating both bounds."
    },
    "transitions": {
      "type": "array",
      "minItems": 20,
      "items": { "$ref": "#/$defs/transition" },
      "$comment": "The lower bound of 20 is the documented minimum coverage (every DEAD_* exit + period router branches). The actual v0.1.0 freeze ships 28 rows. Uniqueness of (from, trigger) pairs is enforced by scripts/check-foundation.mjs (todo 9 linter) - JSON Schema draft-07 has no portable keyword for cross-item composite uniqueness in ajv-cli strict mode (same precedent as event-catalog.schema.json)."
    },
    "timeout_allotments": { "$ref": "#/$defs/timeoutAllotments" },
    "substitution_legality": { "$ref": "#/$defs/substitutionLegality" }
  },
  "$defs": {
    "phaseName": {
      "type": "string",
      "enum": [
        "PRE_GAME",
        "JUMP_BALL",
        "LIVE",
        "DEAD_OOB",
        "DEAD_FOUL",
        "DEAD_VIOLATION",
        "DEAD_MAKE",
        "DEAD_HELD",
        "DEAD_PERIOD_END",
        "FT_SEQUENCE",
        "TIMEOUT",
        "PERIOD_BREAK",
        "HALFTIME",
        "OVERTIME_SETUP",
        "POST_GAME"
      ],
      "description": "Authoritative phase enum for v0.1.0. MUST stay in sync with the phases array in this same document; the T9 linter (scripts/check-foundation.mjs) is the cross-check."
    },
    "transition": {
      "type": "object",
      "required": [
        "from",
        "trigger",
        "to",
        "emit_events",
        "notes"
      ],
      "additionalProperties": false,
      "properties": {
        "from": { "$ref": "#/$defs/phaseName" },
        "to": { "$ref": "#/$defs/phaseName" },
        "trigger": {
          "type": "string",
          "pattern": "^[A-Z][A-Z0-9_]*$",
          "minLength": 1,
          "description": "UPPER_SNAKE_CASE trigger name. Triggers are FSM-internal (not EventTypes); they name the input that fires the transition."
        },
        "emit_events": {
          "type": "array",
          "items": {
            "type": "string",
            "pattern": "^[A-Z][A-Z0-9_]*$",
            "minLength": 1
          },
          "description": "EventTypes emitted when this transition fires. Cross-reference against config/event-catalog.json is enforced by scripts/check-foundation.mjs (todo 9 linter) - the schema pins the UPPER_SNAKE shape only. The same precedent (deferred cross-file enum check) is used in event-catalog.schema.json and duration.schema.json."
        },
        "notes": {
          "type": "string",
          "minLength": 1,
          "description": "Short human-readable description of when the transition fires."
        }
      }
    },
    "timeoutAllotments": {
      "type": "object",
      "required": [
        "regulation_total",
        "max_in_q4",
        "overtime_total"
      ],
      "additionalProperties": false,
      "properties": {
        "regulation_total": {
          "type": "integer",
          "const": 7,
          "minimum": 0,
          "description": "Total team timeouts allowed across Q1-Q4 in regulation. Pinned to 7 (NBA modern rule)."
        },
        "max_in_q4": {
          "type": "integer",
          "const": 4,
          "minimum": 0,
          "description": "Maximum number of regulation timeouts a team may carry into Q4. Pinned to 4 (NBA modern rule)."
        },
        "overtime_total": {
          "type": "integer",
          "const": 2,
          "minimum": 0,
          "description": "Total team timeouts allowed per overtime period. Pinned to 2 (NBA modern rule)."
        }
      }
    },
    "substitutionLegality": {
      "type": "object",
      "required": [
        "legal_phases",
        "illegal_phases",
        "notes"
      ],
      "additionalProperties": false,
      "properties": {
        "legal_phases": {
          "type": "array",
          "minItems": 1,
          "uniqueItems": true,
          "items": { "$ref": "#/$defs/phaseName" },
          "description": "Phases in which a SUB event may legally fire."
        },
        "illegal_phases": {
          "type": "array",
          "minItems": 1,
          "uniqueItems": true,
          "items": { "$ref": "#/$defs/phaseName" },
          "description": "Phases in which a SUB event is a kernel error (IllegalPhaseError)."
        },
        "notes": {
          "type": "string",
          "minLength": 1,
          "description": "Free-form clarification of substitution legality rules, including the FT_SEQUENCE sub rule."
        }
      },
      "$comment": "Two cross-property invariants are NOT expressible in JSON Schema draft-07 under ajv-cli strict mode and are enforced by scripts/check-foundation.mjs (todo 9 linter): (1) legal_phases and illegal_phases must be disjoint; (2) their union must equal the phases array (every phase classified). The linter also checks that FT_SEQUENCE appears in illegal_phases (mid-FT subs are illegal by default) since the doc states the only legal FT_SEQUENCE sub windows are pre-first-FT and post-FT_SEQUENCE_END, which the FSM represents as transitions out of FT_SEQUENCE, not as subs inside it."
    }
  }
}
